agency,role,PL,CL,Life,score,NPS,is_easy,comments,category
6411,Principal,,,Life,10,Promoter,Strongly Agree,Easy access to underwriters.,
48250,Producer,Personal Lines,,,6,Promoter,Agree,Easy to use site,Positive
22338,Principal,Personal Lines,Commercial Lines,,5,Promoter,Somewhat Agree,Personal Lines billing and auto policy changes close to renewal date are difficult and cumbersome.  Re order of credit score resulting higer rate at renewal or new business quotes for existing clients makes no sense.,
22131,Producer,,Commercial Lines,,7,Neutral,Agree,"Rating initially can be easy, but sometimes waiting upon others to add lines of coverage can slow down the issuing process greatly.",Process
557,Producer,Personal Lines,Commercial Lines,Life,8,Neutral,Agree,easy but not the easiest of all,Positive
3401494,Principal,Personal Lines,,,9,Promoter,Agree,"Great carrier, good products, great relationship with underwriter.  Need to have a personal lines account billing option.",Process
4501307,Principal,Personal Lines,,Life,10,Neutral,Agree,Your system is one of the best but your rates still aren't where they must be,Pricing
14041,Principal,Personal Lines,Commercial Lines,Life,8,Neutral,Somewhat Agree,Personal lines rates needs improvement,
48480,Principal,Personal Lines,,,9,Promoter,Strongly Agree,Products and underwriting,
1614,Customer Service Representative (CSR),,Commercial Lines,,9,Neutral,Somewhat Agree,We still have some underwriter issues,
39113,Principal,Personal Lines,Commercial Lines,,4,Detractor,Strongly Disagree,We were trying to write commercial auto and the underwriter was unwilling to approve a few quotes due to having more commercial premium than personal.,
1201068,Principal,Personal Lines,Commercial Lines,Life,10,Promoter,Strongly Agree,They understand that ease of doing business is essential these days,
2095,Principal,Personal Lines,Commercial Lines,,10,Promoter,Agree,,
1001465,Producer,,Commercial Lines,,10,Promoter,Strongly Agree,Its very easy to deal with web & Underwriting,
4375,Producer,Personal Lines,,Life,10,Promoter,Strongly Agree,Programs are easy to work and underwriting is great to work with. The ease of doing business..,
4714,Principal,Personal Lines,,,10,Promoter,Neither Agree nor Disagree,Response time too slow.,
48211,Producer,Personal Lines,Commercial Lines,,10,Promoter,Strongly Agree,Ease of doing business. Underwriter work with us on an individual client basis. Good claims service,
4101202,Customer Service Representative (CSR),,Commercial Lines,,10,Promoter,Strongly Agree,Kyle and Heidi are very easy to work with and it makes wanting to put business with Grange that much more enticing.,
1001392,Producer,Personal Lines,Commercial Lines,,9,Promoter,Strongly Agree,Easy to access,
22404,Customer Service Representative (CSR),Personal Lines,,,10,Promoter,Strongly Agree,"Our underwriter is very easy to work with, easy working on your system",
1301290,Producer,Personal Lines,,,10,Promoter,Strongly Agree,Grange consistently has great rates and coverage's!,
1601066,Principal,Personal Lines,Commercial Lines,Life,9,Promoter,Strongly Agree,Support from Our Rep. company commitment to bring uniqueness to insurance.,
4732,Customer Service Representative (CSR),Personal Lines,,,8,Neutral,Agree,I like that you have information next to each endorsement/coverage that allows us to discuss with client without having to change screens and look up elsewhere.,Positive
3402026,Other,Personal Lines,,,10,Promoter,Agree,,
2040,Principal,Personal Lines,,,6,Promoter,Somewhat Agree,billing sometimes not easy to understand,
48382,Principal,,Commercial Lines,,8,Detractor,Agree,Issuing commercial bop seem a little choppy at the end when a n underwriter is needed for review,User Design
1301527,Principal,Personal Lines,,,9,Promoter,Agree,We have been very satisfied with Grange; underwriting and claim service.,Positive
14737,Customer Service Representative (CSR),Personal Lines,,,3,Detractor,Neither Agree nor Disagree,,
1201146,Principal,Personal Lines,,,8,Detractor,Somewhat Agree,GOOD AUTOMATION,
3901455,Principal,Personal Lines,,,7,Promoter,Somewhat Agree,I would agree more if we had a sales rep that we could call and have a personal relationship with.,
3701463,Principal,Personal Lines,Commercial Lines,,10,Neutral,Strongly Agree,The software rates and the rate is almost always the rate !,
48790,Customer Service Representative (CSR),Personal Lines,,,10,Promoter,Strongly Agree,The website is very user friendly,
1001606,Producer,Personal Lines,,Life,9,Promoter,Agree,Very easy to quote. Great Customer service,Positive
1001502,Producer,Personal Lines,,,8,Promoter,Strongly Agree,It is very easy to deal with Grange.  I can always get a hold of an underwriter and they are able to walk me through step by step,
4501199,Principal,Personal Lines,Commercial Lines,Life,7,Neutral,Strongly Agree,easy to use rating systems.  Price competitive often enough to write some business.,
22781,Principal,Personal Lines,Commercial Lines,,10,Promoter,Strongly Agree,The site is really easy to use and the underwriters are great to work with!,
3701550,Producer,,,Life,8,Promoter,Strongly Agree,Easy application,
3401410,Principal,Personal Lines,,Life,6,Promoter,Somewhat Agree,sometimes difficulty with UW communication response times to e-mail.,
4527,Customer Service Representative (CSR),Personal Lines,,,10,Neutral,Somewhat Agree,Pricing is good but coverages aren't for high value clients. I feel Grange is moving towards a price based client not the whole account concept as in the past. Using the system is easy but its square peg in square hole based; not a customized product unless its for lower coverages/options.,
3701022,Producer,,Commercial Lines,,10,Promoter,Strongly Agree,Ease of doong business in regards to their website and comminications with the underwriting team,
1264,Customer Service Representative (CSR),,Commercial Lines,,10,Promoter,Agree,"Grange is a solid company and I have received comments from clients about how pleased they are with claims handling especially during the 2011 and 2012 TN tornadoes.  I also enjoy working with your technology that simplifies the ease of doing business with Grange.  The only reason I hold back on the highest of ratings is that while I enjoy working with Grange, it is not necessarily the best fit for every client, but for those that fit the niche of the business Grange wants to write, then Grange is always going to be in the running.",Process
22188,Producer,,Commercial Lines,,10,Promoter,Strongly Agree,Anne Hemann and Jen do an excellent job as Underwriters,
2075,Customer Service Representative (CSR),Personal Lines,,Life,5,Detractor,Somewhat Agree,"Grange has had some big increases, but they are normally very easy to work with.",
48722,Customer Service Representative (CSR),,Commercial Lines,,9,Promoter,Agree,Underwriters are helpful.,Positive
145,Producer,Personal Lines,,,8,Neutral,Agree,I always try to write with Grange; my Underwriter is the best in the business,Positive
48159,Producer,Personal Lines,,,8,Detractor,Somewhat Agree,When you switched to Pin Point the severity that you surcharge for auto and home claims is out of my comfort level.  I also do not agree with making all roofs ACV at 15 years.  There are a lot of 30 - 40 year shingles out there so that is unfair to those clients.,
22019,Producer,Personal Lines,Commercial Lines,,9,Promoter,Somewhat Agree,"Our underwriters are great- however, we need more competitive personal lines rates in MN.",
48440,Producer,Personal Lines,Commercial Lines,,10,Neutral,Agree,"Right now the new programs seem to be more competitive which is appealing when we are quoting multiple carriers.  My issue is that I have seen a decline in customer satisfaction on claims (slower turn around and response time).  Additionally, the additional of new home and auto programs every year gets a little bit frustrating.  I wish Integrity could find a product and stick with it.",Process
21232,Producer,,Commercial Lines,,8,Neutral,Agree,"EODB, good customer service, responsive underwriting",Positive
6210,Principal,,Commercial Lines,,9,Detractor,Somewhat Disagree,Had a large book of business that has decreased over last few years.  Constant issue's with lack of response from UW and Management,
48082,Principal,Personal Lines,,,8,Promoter,Neither Agree nor Disagree,Adjusters don't do a very good job of communicating with people.,
48186,Producer,Personal Lines,Commercial Lines,,9,Promoter,Strongly Agree,Software rating is fairly convenient.  Great group of underwriters. Clients happy with claim service,
4101015,Producer,,,Life,10,Promoter,Strongly Agree,It is the best company to represent.  Always ready to lend a helping hand.  Great company because they employ great people!,
1197,Producer,Personal Lines,Commercial Lines,,7,Detractor,Somewhat Agree,Rates hinder writing some policies,
1201148,Producer,Personal Lines,,,5,Promoter,Agree,agree,Positive
3401280,Producer,Personal Lines,,,9,Promoter,Strongly Agree,You guys are awesome!!!,
4323,Principal,Personal Lines,Commercial Lines,,2,Detractor,Disagree,"the multi-variant rating is impossible to explain to insureds when they make a change.  so much change in products lines, not confident I can tell insureds what is covered or not covered",
14767,Customer Service Representative (CSR),,Commercial Lines,,8,Neutral,Agree,Endorsements are easy to submit and the staff is very friendly with their communications.,Positive
4431,Principal,Personal Lines,Commercial Lines,,6,Promoter,Strongly Agree,Good experiences with Grange for many years as an agent,
3402001,Producer,Personal Lines,,,10,Promoter,Agree,WEB SITE IS EASY TO USE  VERY HELPFUL BILLING DEPT.,Positive
48381,Customer Service Representative (CSR),Personal Lines,,,10,Promoter,Strongly Agree,Great Underwriters!  Always willing to work with me.  Also great billing people that help out with questions,
3401280,Producer,Personal Lines,Commercial Lines,,9,Promoter,Agree,I would like to see the addition of recurring credit card payment as an option for personal lines policies.  I would also like to see more commercial options.,Positive
22404,Customer Service Representative (CSR),,Commercial Lines,,8,Promoter,Strongly Agree,The underwriters  are great to work with and the online rating system is very user friendly!,
22404,Producer,,Commercial Lines,,10,Promoter,Strongly Agree,"Ease of doing business, response time, willingness to work with us",
48600,Producer,,Commercial Lines,,10,Promoter,Strongly Agree,"User friendly website to quote and issue.  If underwriting assistance needed, it's very fast.",
4101406,Principal,Personal Lines,,Life,6,Neutral,Somewhat Agree,Billing on the auto & home is difficult,
1201218,Producer,,Commercial Lines,,8,Promoter,Somewhat Agree,Not sure exactly what types of business you are looking to write,
22045,Principal,Personal Lines,Commercial Lines,Life,8,Promoter,Somewhat Agree,I HAVE Had good success with Integrity as a partner,
22019,Producer,Personal Lines,Commercial Lines,,8,Promoter,Agree,Friendly helpful staff and underwriters.,Positive
4235,Customer Service Representative (CSR),,Commercial Lines,,8,Promoter,Agree,"Some procedures are inefficient. For example, an agent has to call an underwriter tech in order to remove cyber liability coverage from a commercial quote the agent is entering on GAINWeb.",Process
48200,Principal,Personal Lines,Commercial Lines,Life,8,Neutral,Agree,Constantly improving the ways to communicate with them and my clients.,Positive
48211,Customer Service Representative (CSR),,Commercial Lines,,4,Promoter,Agree,You're fine,Positive
48790,Customer Service Representative (CSR),Personal Lines,,,9,Promoter,Strongly Agree,We have a great relationship with our PL underwriter Denise Bast and all of the Personal Lines department for that matter,
14022,Producer,Personal Lines,,,10,Promoter,Strongly Agree,I like the personal touch and the ability to work with the underwriters,
3401045,Producer,Personal Lines,Commercial Lines,Life,10,Promoter,Strongly Agree,Positive feedback,
4954,Principal,Personal Lines,Commercial Lines,,10,Promoter,Strongly Agree,I've been with Grange since the early 90's and EODB has been one of the main reasons I strongly agree!,
6179,Producer,Personal Lines,,,7,Neutral,Agree,Employees are easy to work with.,Positive
3401898,Other,Personal Lines,Commercial Lines,,9,Promoter,Agree,There's always room for improvement,Positive
4820,Customer Service Representative (CSR),Personal Lines,,,2,Detractor,Somewhat Disagree,too much product/coverage change...too many add ons to quotes,
4384,Other,Personal Lines,Commercial Lines,Life,9,Promoter,Agree,very easy to use,Positive
1601407,Customer Service Representative (CSR),Personal Lines,,,6,Neutral,Somewhat Agree,"You used to have the easiest EODB quoting and issue and now it is way to cumbersome. You can't even seem to label stuff easily, for example build a quote, why not just quoting options????????",
48231,Producer,,,Life,5,Detractor,Neither Agree nor Disagree,I have only been listed with Integrity for a couple weeks and know very little about the company.,
4080,Producer,Personal Lines,,,8,Promoter,Strongly Agree,Grange Ins Co is a locally based company Grange Ins Co claims office is locally based Grange Ins Co offers a discount to the auto policy when a life policy is placed with Grange Grange Ins Co is highly rated by A.M. Best Company Grange Ins Co has the ease of doing business,
1601474,Principal,Personal Lines,Commercial Lines,Life,10,Promoter,Agree,"Personal Lines and Commercial straight-through processing are always very easy; however, on occasion, I have had a lengthy delay and even no response to a commercial submission that required underwriter approval. I lost the account while waiting and never did receive any follow-up.",Positive
6248,Other,,Commercial Lines,,8,Neutral,Somewhat Agree,Quote system is easy but appetite is a little basic,
2111,Principal,,Commercial Lines,,7,Promoter,Somewhat Agree,our underwriter does a great job of helping us. not thrilled with quoting new biz,
3402105,Principal,Personal Lines,,,8,Promoter,Strongly Agree,Grange is constantly working to better their product and their relationship with their agents,
3390,Customer Service Representative (CSR),,Commercial Lines,,6,Neutral,Somewhat Agree,loosing a lot of business with them due to rates,
48032,Customer Service Representative (CSR),Personal Lines,,,9,Promoter,Agree,rater is easy to use and people in the billing department/underwriting are always very helpful,Positive
48722,Producer,Personal Lines,,,9,Promoter,Strongly Agree,My underwriter Denise Bast is great to work with to get a risk written.,
21120,Principal,,Commercial Lines,,8,Detractor,Disagree,COMMERCIAL UNDERWRITING HAS BECOME MORE RESTRICTIVE AND PERSONAL LINES IS SO UNCOMPETITIVE THAT GRANGE RATES ARE USUALLY DEAD LAST IN OUR RATER,
4279,Principal,Personal Lines,,,9,Promoter,Agree,Your systems are easy to use,Positive
14768,Principal,,Commercial Lines,,10,Promoter,Strongly Agree,Easiest rater in the business and I know the coverage is broad.,
1309,Producer,Personal Lines,Commercial Lines,,8,Detractor,Somewhat Agree,"Sometimes I have difficulty in getting through to talk to someone on the phone.  Also, it would be nice to have a marketing  rep call on our agency occasionally so that we know whats going on with the company.  We use to have a much better feel for things when Troy Cantrell would come by. Thanks",
3402013,Principal,Personal Lines,,Life,10,Promoter,Strongly Agree,Systems are great. Underwriting is extremely knowledgeable and helpful. Sales Support is great too.,
48192,Principal,Personal Lines,Commercial Lines,,9,Promoter,Agree,We love Integrity they are great to work with and financially strong.,Positive
4367,Principal,Personal Lines,,,9,Promoter,Strongly Agree,,
22413,Producer,Personal Lines,,,6,Neutral,Agree,"The support is great, but pricing is usually an issue.",Positive
14388,Customer Service Representative (CSR),,Commercial Lines,,8,Neutral,Agree,"From a service standpoint, Integrity policies are easy to read and understand. Endorsements are the same, descriptions and amounts bold and present. Response time is great with our underwriters.",Positive
3701494,Producer,Personal Lines,Commercial Lines,,10,Promoter,Strongly Agree,So far we have a great experience! Thank you to our local sales rep Brittany Krebs,
1201084,Producer,Personal Lines,,,9,Promoter,Somewhat Agree,the system is easy to use.,
48383,Producer,Personal Lines,,,9,Promoter,Strongly Agree,User friendly quote entry and billing look-up.  Easy to print ID cards and lienholder info.,
1201367,Customer Service Representative (CSR),,Commercial Lines,,10,Promoter,Strongly Agree,Easy access on web and easy to work with when you need additional information.,
4602,Principal,Personal Lines,,Life,7,Promoter,Strongly Agree,Good Relationships with corporate folks.,
1001211,Principal,Personal Lines,,Life,10,Promoter,Strongly Agree,Quoting and Servicing systems are efficient and easy to use. I can quickly find information.,
3701551,Producer,,,Life,7,Detractor,Strongly Disagree,Canceled all life appointments,
4910,Customer Service Representative (CSR),Personal Lines,,,10,Promoter,Strongly Agree,"Our Underwriter, Belinda Haynes is very kind and helpful and mostly does accommodate our requests. Each time I have called billing or tech support, they have been very helpful and clear on what I need to do to get past my technical issue, and I have always been able to get my issues resolved.  I do think a $25.00 late fee is a little excessive. Cincinnati only charges a $10.00 rescission fee and Encompass just sends out another bill for the next month with a $5.00 billing fee.  Thank you!!",
1201481,Principal,,Commercial Lines,,10,Promoter,Strongly Agree,Grange offers great coverages for a fair price. Underwriters are very easy to work with and knowledgeable. Great customer service in policy servicing and claims.,
1907,Producer,Personal Lines,,,9,Neutral,Agree,Easy to quote and competitive.,Positive
48073,Producer,Personal Lines,Commercial Lines,Life,8,Detractor,Somewhat Agree,Sometimes I think there could be more exceptions. If the system gives you a price then you should be able to write,
1573,Customer Service Representative (CSR),Personal Lines,,,10,Promoter,Agree,They have lowered their auto rates and have become more competetive,Positive
48224,Producer,Personal Lines,,,9,Promoter,Agree,NO COMMENT,Positive
22420,Customer Service Representative (CSR),Personal Lines,,,10,Promoter,Strongly Agree,"The clients I have with Integrity are very satisfied clients, and every time I work with one of the staff from Integrity they are always friendly and helpful.  I've never had to wait long for a answer to a question or reply.",
48795,Producer,Personal Lines,,,7,Neutral,Somewhat Agree,,
1001018,Producer,Personal Lines,Commercial Lines,,5,Neutral,Neither Agree nor Disagree,System is user friendly however rates have not been competive.,
48722,Producer,Personal Lines,,Life,9,Neutral,Agree,The site is very user friendly.  They live chat is wonderful to access and they are helping ASAP! Thank you!,Positive
48231,Customer Service Representative (CSR),Personal Lines,,,9,Promoter,Agree,"The only thing I would like to see change, is with changes, to not have to select to change the renewal also. If the change is done close to the policy, it should automatically change the renewal I feel.",Positive
48032,Principal,Personal Lines,Commercial Lines,Life,10,Promoter,Strongly Agree,Have had GREAT claims service as well as customer service from all at Integrity!!!!,
4776,Customer Service Representative (CSR),Personal Lines,Commercial Lines,,8,Promoter,Agree,"I have had Grange for my personal insurance and was happy with their service. The billing is somewhat confusing, especially when making changes to policy mid-term. On the agency side, I find the site user-friendly.",Process
48187,Customer Service Representative (CSR),Personal Lines,,,10,Promoter,Agree,Your quoting process is easy to follow and complete,Positive
1201304,Customer Service Representative (CSR),,Commercial Lines,,10,Promoter,Agree,Quoting goes really quickly as long as it is just online,Positive
48352,Customer Service Representative (CSR),Personal Lines,,,8,Promoter,Agree,Integrity Insurance is pretty competitive with other companies. Easy of use on the site also.,Positive
1201001,Producer,Personal Lines,Commercial Lines,Life,7,Detractor,Somewhat Agree,Some of grange products are priced not to be able to sell,
48186,Other,Personal Lines,,,8,Promoter,Strongly Agree,"Ease of quoting/uploading, easy website to follow and very accessible underwriters & assistants.",
4101375,Producer,Personal Lines,Commercial Lines,Life,7,Detractor,Somewhat Disagree,We don't recommend carriers per say we recommend the best coverage for the best price that fits your needs. If Grange is that carrier then we recommend. Reaching an underwriter is almost impossible. It is almost laughable at times thus Grange does not make it easy to do business.,
795,Customer Service Representative (CSR),Personal Lines,,,8,Neutral,Agree,"Our current underwriter Nikki Barker is the best,  no complaints on anything else Except that every time we  delete an auto the premiums increase on the others even if they still have the multi car discount.  Customers don't get that type of algorithm.",Positive
48240,Principal,Personal Lines,Commercial Lines,,10,Promoter,Agree,Good company and easy to rate the policy. Knowledgeable staff.,Positive
3108,Producer,,Commercial Lines,,9,Promoter,Agree,they are a good company with an easy system to navigate.  the only problem I have is with the comm auto and any endorsements which totally change and sometimes don't make sense,Positive
2274,Customer Service Representative (CSR),,Commercial Lines,,7,Detractor,Somewhat Agree,"I am not extremely familiar with Grange, but so far so good.",
3293,Principal,Personal Lines,Commercial Lines,Life,9,Detractor,Agree,Excellent underwriters and field reps. Online presence is good also.,Positive
48171,Principal,Personal Lines,Commercial Lines,,10,Promoter,Agree,easy agent web site and rating. good claim servcie,Positive
3401713,Customer Service Representative (CSR),Personal Lines,Commercial Lines,,8,Promoter,Agree,I think they are a good company to do business with,Positive
3401020,Producer,Personal Lines,Commercial Lines,Life,9,Promoter,Strongly Agree,"Grange is always very cooperative and helpful.  Also, they are local.  If we are close on rates I tend to lean towards them.",
14061,Producer,Personal Lines,,,9,Neutral,Agree,Because your site is easy to work with but not as competitive in some areas,Pricing
4101479,Principal,Personal Lines,,Life,10,Promoter,Strongly Agree,"I am very please with your products and the means by which to quote and issue them. I look forward to having access to your commercial lines. That I have been requesting for a few month, hopefully soon.",
14004,Other,,Commercial Lines,,8,Promoter,Agree,good product and premium,Positive
2122,Producer,Personal Lines,,,10,Promoter,Agree,"Grange has a user friendly interface for quotes. In the past, claims have been paid quickly and justly.",Positive
22109,Principal,Personal Lines,Commercial Lines,,10,Detractor,Somewhat Disagree,I feel I do not have the support of Integrity.,
48453,Customer Service Representative (CSR),Personal Lines,Commercial Lines,,8,Neutral,Agree,Comfortable with the rating and software programs.  Easy to quote and issue,Positive
22516,Principal,Personal Lines,Commercial Lines,,9,Detractor,Disagree,Integrity Mutual does everything they can to stop agents from writing business in the State of MN. You guys know this so I don't think I really need to explain myself.,
1059,Producer,Personal Lines,,,10,Promoter,Agree,"From the rating system to the Grange staff we sometimes need to call, everything is easy to work with.",Positive
4093,Customer Service Representative (CSR),Personal Lines,Commercial Lines,,9,Neutral,Agree,Premiums are market segment competitive and with new endorsements added like accident forgiveness it makes it easier to move a client that may lose that option otherwise.,Positive
3701542,Principal,Personal Lines,Commercial Lines,,7,Neutral,Somewhat Agree,"Overall, I think Grange is a good company. However, I think some of the underwriting needs to be adjusted on homes. I've found it to be a bit restrictive. I had a policy cancel due some vines. I'd also do something with auto rates for preferred customer and also with people that have kids. Grange is often 30% more and I'd think the company would want to compete for relatively low risk business like that.",
12,Principal,,Commercial Lines,,10,Promoter,Strongly Agree,"rating is easy, and my underwriter Monica Jeffries is very helpful.",
1259,Customer Service Representative (CSR),,Commercial Lines,,10,Promoter,Agree,The ease of doing with Business with Grange is enough in itself to recommend them.,Positive
3701637,Principal,Personal Lines,,,9,Promoter,Strongly Agree,Grange has been responsive to feedback,
3701620,Producer,Personal Lines,,Life,10,Promoter,Strongly Agree,Great experiences !,
1201034,Other,,Commercial Lines,,8,Promoter,Agree,My staff knows quickly if Grange is interested and competitive,Positive
48700,Producer,Personal Lines,,,10,Promoter,Agree,Integrity is a great company.  The staff are friendly and easy to work with.,Positive
128,Customer Service Representative (CSR),Personal Lines,Commercial Lines,,10,Promoter,Strongly Agree,User friendly website. Very easy to rate on.  Friendly and helpful underwriter.,
1201118,Principal,Personal Lines,Commercial Lines,,5,Promoter,Somewhat Agree,"does not have all the coverage's and perks as some, hard to navigate the system for documents",
3701595,Principal,,,Life,6,Detractor,Strongly Disagree,I was terminated after trying to writw p& c also. They told me the company had restructured and no longer wanted life only agents.,
