agency,role,PL,CL,Life,score,NPS,is_easy,comments,category
3701579,Principal,Personal Lines,,,8,Promoter,Agree,I'm in business to serve my clients and to grow regularly and provide good business to the company.,Positive
4101335,Producer,Personal Lines,,,9,Promoter,Agree,Great company Ease of rating software,Positive
22403,Producer,Personal Lines,Commercial Lines,,10,Promoter,Strongly Agree,"I love my underwriter, Dawn Green.  She is easy to work with, to work on problems and knowledgeable.",
48073,Producer,Personal Lines,,,8,Promoter,Agree,everything is right there and if not can find it if needed,Positive
3401420,Principal,Personal Lines,,,10,Promoter,Strongly Agree,GRANGE IS GREAT WITH UNDERWRITING SERVICE  AND CLAIMS SERVICE AND CUSTOMER SERVICE,
6215,Producer,Personal Lines,,,10,Promoter,Strongly Agree,"great rates, ease of website and great claims service to name a few things. flexible underwriting when needed with rates that seem reasonable",
3401602,Customer Service Representative (CSR),Personal Lines,Commercial Lines,Life,8,Neutral,Agree,Grange has an excellent team of representatives and its interface and technology make working with them very easy.,Positive
1601506,Other,,Commercial Lines,,6,Neutral,Agree,Underwriter is responsive and personable and seems eager to write new business with us.,Positive
423,Producer,,,Life,8,Neutral,Somewhat Agree,Internal agents rarely return calls.  This is an issue if I am working on a quote and time is of the essence,
2101648,Principal,Personal Lines,,,2,Detractor,Disagree,Rates on personal lines are more often than not double to triple. Website isn't all that user friendly.,
3401145,Customer Service Representative (CSR),,Commercial Lines,,9,Promoter,Strongly Agree,Vast IMPROVEMENT in working with underwriter on new business.  Patrick does an excellent job and does what he can to help facilitate the writing of new business.,
1201001,Producer,,,Life,10,Promoter,Strongly Agree,The companies system interface is very easy to use.,
4501307,Producer,Personal Lines,,,7,Promoter,Agree,grange has excellent products and the rates are more competitive all the time. I look forward to doing business with them in the future!,Positive
186,Customer Service Representative (CSR),Personal Lines,,,9,Promoter,Agree,Website is user friendly and Customer Service is available and helpful.,Positive
4323,Customer Service Representative (CSR),Personal Lines,,,10,Promoter,Strongly Agree,It is easy to navigate making changes and quoting in the system. Underwriters are easy to work with.,
1601221,Principal,Personal Lines,,,9,Promoter,Strongly Agree,"Every interaction I have had with anyone from Grange has always been polite, helpful and goes above and beyond.",
22134,Other,,Commercial Lines,,7,Neutral,Disagree,The billing / down payment is very confusing. no I can't,
4501094,Producer,Personal Lines,,,8,Neutral,Somewhat Agree,"REALLY LIKE THE COMPANY, BUT I WOULD LIKE YOU BE MORE ACCEPTABLE WITH INTERNATINAL LICENSES OR NO SS",
1601246,Other,,Commercial Lines,,5,Detractor,Neither Agree nor Disagree,Ease of use for rating and underwriter response.,
48082,Producer,Personal Lines,,,9,Neutral,Agree,Rate has to be competitive.    It all depends on the situation.,Positive
48001,Other,Personal Lines,Commercial Lines,,8,Promoter,Agree,good communication at all levels of organization,Positive
1232,Producer,Personal Lines,,,8,Neutral,Somewhat Agree,Company appetite and underwriting guidelines change too often. Need more stability.,
2101636,Principal,Personal Lines,Commercial Lines,,8,Detractor,Agree,"Don't have a lot of business with Grange, mainly due to pricing issues.  Pretty easy to do business with overall.",Pricing
4124,Principal,Personal Lines,Commercial Lines,,10,Promoter,Strongly Agree,Grange absolutely has the fastest and easiest process for me to quote customers.,
2101210,Principal,,Commercial Lines,,6,Neutral,Somewhat Agree,Grange is a well known regional carrier with some programs we have opportunities with. For some opportunities the system is easy to work with. For other items sometimes it takes too long to get out of rating.,
3401476,Producer,Personal Lines,,,10,Promoter,Strongly Agree,Grange is an extremely user friendly company to do business with,
48722,Producer,,Commercial Lines,,9,Promoter,Agree,Things have gone well so far!,Positive
4191,Principal,Personal Lines,Commercial Lines,Life,10,Promoter,Strongly Agree,"Competitive pricing, advanced coverage options,ease of rating with quality claims service.",
4079,Customer Service Representative (CSR),Personal Lines,,,8,Neutral,Agree,"Grange is a good company, but the premium increases every renewal are a little much.",Pricing
6124,Producer,Personal Lines,Commercial Lines,Life,4,Promoter,Somewhat Agree,"Grange rating has been out of line in our area for quite awhile.  Even though they have been very profitable, they have run a lot of very good clients away with higher than necessary rates.  In my opinion they have forgotten their long term agencies and customers in their mission.",
3401568,Principal,,Commercial Lines,,8,Neutral,Agree,My producers like the platform,Positive
3401851,Principal,Personal Lines,Commercial Lines,Life,9,Promoter,Agree,a fine 1 st class organization. proud to be affiliated with them,Positive
39011,Producer,Personal Lines,Commercial Lines,,7,Neutral,Somewhat Agree,competitive auto insurance is hard to come by in todays market,
126,Principal,Personal Lines,,,8,Detractor,Agree,Recommending Grange to a client depends on what type of insurance the client is in need of.  Auto insurance is reasonably priced but property insurance is not.  If they need both auto and property we would normally go to another carrier.,Positive
3401734,Producer,Personal Lines,,Life,10,Promoter,Strongly Agree,"Great rates, love the underwriters, easy quoting and issuing, variety of products.",
4588,Producer,Personal Lines,Commercial Lines,,10,Promoter,Strongly Agree,Love selling Grange it is easy to use and if you do get stuck you can get help quickly,
4501353,Producer,Personal Lines,,Life,9,Promoter,Somewhat Agree,"For non-rated drivers, most of my other carriers require their name, date of birth and a copy of their insurance, You all require the drivers license number also, it is hard enough to get the copy of the declaration page. I abide by your guidelines but I think you all lose business because of this. Just an observation. I enjoy working with you all! Great company.",
1601567,Principal,Personal Lines,,,10,Promoter,Strongly Agree,THE RATES ARE GREAT AND THE FORMAT MAKES IT EASY TO EXPLAIN TO CLIENTS.,
6215,Other,Personal Lines,Commercial Lines,,9,Promoter,Agree,The website is easy to use and their claims handling is awesome.,Positive
2101350,Producer,Personal Lines,,,10,Promoter,Somewhat Agree,I love writing with Grange -easy and quick. Only difficulty is rates are not competitive.,
22783,Producer,Personal Lines,,,9,Promoter,Agree,"Website is great, along with the personalized service of the company.",Positive
22050,Principal,Personal Lines,Commercial Lines,,10,Promoter,Strongly Agree,Working with Underwriting and navigating the website has proven to be easy and user friendly.,
1082,Customer Service Representative (CSR),Personal Lines,,,10,Detractor,Disagree,The rates are too high.  I have been with Grange many years and had to switch companies this year because of the high rates.,
4428,Principal,Personal Lines,,,10,Promoter,Strongly Agree,Ease of doing business with Grange is awesome,
48453,Principal,,Commercial Lines,,8,Neutral,Strongly Agree,Very easy company to work with,
2016,Customer Service Representative (CSR),Personal Lines,,,7,Neutral,Neither Agree nor Disagree,,
22002,Producer,Personal Lines,Commercial Lines,,9,Neutral,Somewhat Agree,Premiums are generally higher than any other companies I rate.,
3401402,Principal,Personal Lines,Commercial Lines,Life,8,Promoter,Strongly Agree,easy to use,Positive
22726,Other,,Commercial Lines,,8,Promoter,Agree,I appreciate the user friendly quoting system that Integrity offers.,Positive
22188,Producer,Personal Lines,Commercial Lines,Life,8,Promoter,Agree,"Rates and forms. The forms are easy to use for the most part,and the rate's tend to be competative",Positive
21161,Producer,Personal Lines,Commercial Lines,Life,7,Detractor,Somewhat Agree,I would recommend Grange to a client if the premium was competitive. The problem is is that they rarely are. The online quoting system is pretty intuitive.,
4821,Customer Service Representative (CSR),Personal Lines,,Life,9,Neutral,Agree,For whatever reason our relations ship with Grange is not as good as with our other carriers.,Positive
14752,Principal,Personal Lines,,,3,Promoter,Neither Agree nor Disagree,"Quality company, good rates and good claims service rate a 10 on the recommendation scale.  However, a non-user friendly website makes it difficult to do business with Integrity.",
4304,Principal,Personal Lines,,,10,Promoter,Strongly Agree,You still have the BEST rating software compared to other carriers websites.,
3357,Customer Service Representative (CSR),Personal Lines,,,10,Promoter,Strongly Agree,Grange is very easy to work with. It is one of the easiest companies to do changes and taking payments,
3402104,Principal,Personal Lines,,,7,Promoter,Agree,"Grange has a great product and with recent changes the premiums have become more competitive. The automated system can still be a little cumbersome i.e. requiring a SSN and making changes to incorrect info pulled into the quoting system from reports. However, I am still relatively new to Grange and this could be user error.",Process
4958,Customer Service Representative (CSR),Personal Lines,,,10,Promoter,Agree,I personally have my insurance with Grange and have also represented Grange for many years.,Positive
22336,Producer,Personal Lines,,,10,Promoter,Strongly Agree,Love your website...easy to quote and know when a customer is eligible for a policy with Integrity.,
6266,Customer Service Representative (CSR),Personal Lines,,,10,Neutral,Strongly Agree,rating system is easy to use,
6083,Producer,Personal Lines,,,10,Promoter,Strongly Agree,Grange website is very user friendly; the underwriters are great to work with,
3701032,Producer,Personal Lines,,,8,Neutral,Agree,"An architectural shingle roofs are usually 30-40 yrs life expectancy here in Pa, but if they are over 15 yrs old your loss settlement is ACV only? You are the only company that caps that at 15yrs.",Process
45022,Principal,Personal Lines,,,7,Neutral,Somewhat Agree,"Rating anomalies on youthfulls, older clients, liability only and large rate hikes for minor violations make it difficult to retain clients.",
22158,Principal,Personal Lines,Commercial Lines,Life,8,Promoter,Agree,Nothing but positive experiences so far.  Maybe Integrity should allow a small grace period on passport auto policies or ability to easily reinstate with lapse.,Positive
4231,Principal,Personal Lines,,,9,Promoter,Agree,,
3701382,Producer,,Commercial Lines,,7,Neutral,Somewhat Agree,occasional slow communication with correspondence,
3401162,Producer,Personal Lines,,,10,Promoter,Strongly Agree,grange has the best coverage and best employees. never had a client that was upset with grange that wasn't their fault to begin with.,
21158,Producer,,,Life,9,Neutral,Strongly Agree,I usually do quote comparisons and include the companies that offer the product the insured is interested in,
2101087,Producer,Personal Lines,Commercial Lines,Life,7,Detractor,Somewhat Agree,I don't view Grange as stable in the marketplace.  The rating systems are average to above average.,
3401529,Principal,Personal Lines,,,10,Promoter,Strongly Agree,"Product line-up, rates.  PLEASE UPDATE GAIN WEB TO SHOW YOUR FAX NUMBER ! :)",
14013,Producer,,Commercial Lines,,8,Promoter,Somewhat Agree,"Products are good, claims are good.  Sometimes hard to get to an underwriter when questions arise.",
4004,Principal,Personal Lines,Commercial Lines,Life,9,Neutral,Strongly Agree,Much more likely to recommend Grange to a personal lines client.,
3701495,Principal,Personal Lines,Commercial Lines,Life,8,Promoter,Somewhat Agree,The system has too many stops that cause calls in to underwriting when it comes to address verifications,
48288,Customer Service Representative (CSR),,Commercial Lines,,10,Neutral,Agree,"For the most part, all is good.  Our renewal underwriter can sometimes be a bit difficult, in that I will ask for the cost of a scheduled additional insured endorsement, and his response will be to use the blanket additional insured form.  If I am asking for the cost, it is because I need to know the cost, because the blanket was not accepted.  It is an unnecessary step on my part.  Our new business underwriter is fantastic!",Service
2101517,Producer,,Commercial Lines,,8,Detractor,Neither Agree nor Disagree,Not enough volume with Grange to know how easy it is to do business,
4050,Principal,Personal Lines,,,10,Promoter,Strongly Agree,,
4107,Principal,Personal Lines,,,7,Detractor,Somewhat Agree,,
21155,Customer Service Representative (CSR),Personal Lines,,,5,Neutral,Agree,"Easy billing program ,easy to view and download",Positive
4101208,Other,Personal Lines,,,8,Neutral,Agree,wide variety of products that are available.,Positive
4100,Principal,Personal Lines,,,7,Neutral,Neither Agree nor Disagree,GRANGE IS OUR PRIMARY CARRIER,
6198,Producer,,,Life,8,Neutral,Agree,I would like to see quicker underwriting on sensible benefits,Service
22001,Customer Service Representative (CSR),,Commercial Lines,,7,Detractor,Somewhat Agree,This depends on which Underwriter we have to deal with.,
4593,Other,,Commercial Lines,,9,Promoter,Strongly Agree,Grange is competitively priced and a reputable company that offers a good product. They make it easy to quote and make changes to customer policies.,
21201,Customer Service Representative (CSR),Personal Lines,,,8,Neutral,Somewhat Disagree,The rates are not competitive in Michigan,
21322,Customer Service Representative (CSR),,Commercial Lines,,8,Promoter,Agree,"ease of use in the systems, pricing",Positive
6380,Producer,Personal Lines,Commercial Lines,,7,Detractor,Agree,Grange personal line rates are not competitive in our area.,Positive
3401747,Principal,Personal Lines,,,8,Promoter,Somewhat Agree,"I love doing business with locally owned businesses. Grange has great product and, as of late, has very competitive pricing on personal lines business. We have not seen our agency rep in about 18 months and we feel unimportant to the Company. That doesn't stop us from trying to build a solid book so we can grab someone's attention, though. It can be a bit confusing trying to get to different areas to service policies. It would be great to have one place where we can choose to endorse, cancel, view billing, etc. The software is pretty good once we find what we're looking for, and the home office personnel are great. Thank you.",
14077,Principal,,Commercial Lines,,9,Promoter,Agree,good coverage and rates,Positive
3701072,Customer Service Representative (CSR),,Commercial Lines,,10,Promoter,Strongly Agree,Ease of doing business,Positive
3391,Principal,Personal Lines,Commercial Lines,Life,9,Promoter,Agree,"Compared to the other companies I represent, Grange makes it much more agent friendly to make simple changes, or if there is a question, easy to access underwriting, claims or billing.",Positive
3401515,Principal,Personal Lines,,Life,8,Promoter,Strongly Agree,"UW are so great to work with. Once ttrust is established, you can communicate back and forth and they support you and they know that you have Grange and your agency best interest always at heart.",
1601151,Principal,Personal Lines,,,7,Promoter,Agree,website is user friendly,Positive
4209,Producer,Personal Lines,,,9,Neutral,Agree,Grange has a very competitive home and auto product,Positive
4351,Customer Service Representative (CSR),,Commercial Lines,,10,Neutral,Agree,"I have Grange insurance myself, so it is easy to recommend to clients. Rates are reasonable and customer service is great.   Grange's agent website is easy to navigate and use making quoting easy. I like the underwriter I typically work with - he is responsive and helpful.",Positive
4101099,Principal,Personal Lines,,Life,9,Promoter,Strongly Agree,,
1601471,Customer Service Representative (CSR),,Commercial Lines,,9,Promoter,Strongly Agree,When I placed a quote online it accidentally got issued-not sure what happened but I emailed Leslie Fritinger and she had it switched to a quote immediately.  I really appreciated her help!!  The online quote process was very user friendly.,
3901311,Customer Service Representative (CSR),Personal Lines,,,1,Detractor,Somewhat Disagree,Website could be easier to use. the rating are higher than most carrier. Unable to write full coverage on a vehicle older than 15 years.,
1001020,Producer,Personal Lines,,,10,Promoter,Strongly Agree,Your website is simple to use.  I the agent can process all changes and cancellations when needed.  Your billing and payment systems are easy to read and use.  Grange is very agent and user friendly.,
3401493,Customer Service Representative (CSR),Personal Lines,,,6,Neutral,Somewhat Agree,"I'm a new agent, I find it difficult to navigate at times, trying to pull up an account and getting a dec page or billing history.  Quoting is fairly easy",
48569,Principal,Personal Lines,,Life,7,Promoter,Agree,We are very happy with Integrity. We feel there are a few improvements that could be made on the billing and policy processing sides.,Process
3233,Producer,Personal Lines,,,9,Neutral,Strongly Agree,great quoting software,
2101627,Producer,Personal Lines,,,10,Promoter,Agree,N,Positive
4101315,Customer Service Representative (CSR),Personal Lines,,,10,Promoter,Strongly Agree,ease of doing business,Positive
48798,Producer,Personal Lines,,,10,Promoter,Strongly Agree,"I have been placing a lot of business with Integrity and it's because of the website, ease of doing business, our underwriter is incredible and it's overall just a great company!",
48003,Producer,Personal Lines,,,8,Promoter,Strongly Agree,user friendly system,
134,Customer Service Representative (CSR),,Commercial Lines,,10,Promoter,Strongly Agree,"We have a great underwriter and sales rep. that works with us on our accounts.  The renewal premiums are usually in line, and the products are great.",
3701028,Principal,Personal Lines,Commercial Lines,Life,8,Neutral,Agree,Your systems is good.  I wish homeowners underwriting was a little more liberal.,Positive
6361,Customer Service Representative (CSR),,Commercial Lines,,10,Neutral,Strongly Agree,"Great all around service, we just have a issue with rates.",
3701228,Principal,Personal Lines,,,6,Neutral,Agree,,
3701198,Producer,,Commercial Lines,,8,Neutral,Neither Agree nor Disagree,Never really quite certain what or what we can't do with Grange.,
4247,Producer,Personal Lines,,,9,Neutral,Agree,Grange is a great company and have been easy to work with.  New product development with the new homeowners program.,Positive
1301581,Customer Service Representative (CSR),Personal Lines,Commercial Lines,Life,10,Promoter,Strongly Agree,We are extremely happy with our Grange products.,
4101124,Producer,Personal Lines,,,7,Neutral,Somewhat Agree,"The system is not as easy to use as other companies, but Grange is a good company.",
3401436,Producer,Personal Lines,,,10,Promoter,Strongly Agree,The system is very easy to work through and the rates are really good.,
4619,Customer Service Representative (CSR),Personal Lines,Commercial Lines,Life,10,Promoter,Agree,Great Company!,Positive
48659,Principal,Personal Lines,,,8,Neutral,Agree,true,Positive
14768,Producer,Personal Lines,,,8,Neutral,Agree,I like the ease of doing business and on line rating.  Underwriting is always helpful.  The home rates are higher than most our carrers,Positive
4291,Producer,Personal Lines,,,10,Promoter,Strongly Agree,"agent site is easy to use and I have my own insurance with Grange, would recommend you to a relative or friend without hesitation.",
4144,Producer,,Commercial Lines,,6,Neutral,Agree,Good underwriter,Positive
1001595,Producer,,,Life,10,Promoter,Strongly Agree,Everyone is usually fairly easy to work with and the level of customer service is pretty good. I've only had a few issues but overall I'm satisfied.,
4293,Producer,Personal Lines,,,10,Detractor,Somewhat Disagree,"Compared to other companies the auto rates are much higher for many of the clients that I quote. Also, this applies to the homes in many instances.",
4280,Customer Service Representative (CSR),Personal Lines,,,10,Promoter,Strongly Agree,Ease of doing business,Positive
3701051,Producer,Personal Lines,Commercial Lines,Life,6,Neutral,Somewhat Agree,rates are a little high and Grange website is not the most user friendly,
4501127,Producer,Personal Lines,,,10,Neutral,Agree,Grange is easy to quote and but the rates have not been as competitive as some of our other companies lately.,Positive
4922,Producer,Personal Lines,,Life,7,Neutral,Somewhat Agree,They are constantly changing their products and underwriting guidelines.  And also the people answering the phones in the billing department seem to be unsure of their answers and the hold time is ridiculous.,
4797,Customer Service Representative (CSR),Personal Lines,,,8,Neutral,Agree,Depends on premium and product compared to other carriers. Cannot combine bill policies.,Positive
4293,Producer,Personal Lines,,,9,Promoter,Agree,I AM AN AGENT FOR GRANGE AND ALWAYS GO THERE FIRST THINK THEY ARE A GOOD DEPENDABLE COMPANY.,Positive
3401127,Customer Service Representative (CSR),Personal Lines,,,10,Promoter,Strongly Agree,"easy to use website for quoting, making changes, etc",
4101146,Producer,Personal Lines,,,2,Neutral,Somewhat Agree,The quoting website can be difficult to navigate and frustrating when unclear about errors in the data that has been input.,
1601239,Producer,Personal Lines,,,10,Promoter,Strongly Agree,"The Grange Agent Website makes it easy to write business, make quick changes, and access policy information.",
39022,Producer,,Commercial Lines,,7,Neutral,Agree,no commentr,Positive
1001088,Producer,Personal Lines,,,10,Promoter,Strongly Agree,The website is very user friendly and the rates are very competitive.,
2101159,Producer,Personal Lines,,,6,Detractor,Neither Agree nor Disagree,started off like gang busters but seems harder to write business with Grange - though we do quote,
21332,Principal,Personal Lines,Commercial Lines,Life,10,Neutral,Somewhat Agree,Personal lines rates are not competitive.  Personal lines underwriters not very helpful.  Commercial lines underwriters difficult to work with or get approvals.,
6044,Customer Service Representative (CSR),,Commercial Lines,,8,Promoter,Agree,I have found that the placement and management of coverage has been simple and your system user friendly,Positive
2101055,Principal,,Commercial Lines,Life,8,Promoter,Neither Agree nor Disagree,Your personal lines rates in Mich are terrible. Non competitive. Resaurant program excellent. Life Insurance rates & products excellent.  You have not been a steady business partner.,
4351,Principal,Personal Lines,,,9,Detractor,Agree,your automation is easy to work with,Positive
99,Customer Service Representative (CSR),Personal Lines,,,10,Promoter,Agree,Working with the underwriters is awesome but the high premiums make it difficult to place business most of the time.,Positive
4038,Producer,Personal Lines,,Life,9,Promoter,Agree,to many different auto programs & coverages  - I would like to see auto quotes on existing policies stay longer than 1 day,Positive
3402002,Principal,Personal Lines,,,10,Promoter,Strongly Agree,Grange has developed great products at affordable prices for the consumer.  My go to is always Grange first!,
3275,Producer,Personal Lines,,,9,Promoter,Strongly Agree,technology and our underwriters,
4342,Principal,Personal Lines,Commercial Lines,Life,10,Promoter,Strongly Agree,Been partnering since 1968,
1001497,Principal,Personal Lines,Commercial Lines,,10,Promoter,Strongly Agree,Grange makes completing business easy with their rating and application systems.,
3291,Other,Personal Lines,Commercial Lines,,9,Promoter,Strongly Agree,user friendly system,
1001575,Principal,Personal Lines,Commercial Lines,,9,Promoter,Agree,"Easy quoting process, and help from underwriters",Positive
4018,Principal,Personal Lines,,,10,Promoter,Agree,A lot of times you get their voice mail when you really need an answer as the client is waiting here in the office,Positive
1001393,Producer,Personal Lines,,,7,Neutral,Neither Agree nor Disagree,Some of your underwriting and rating rules are extreme. It takes extra steps to answer all your requirements when rating with EZLink just to see if you're competitive on a preliminary basis.,
48039,Producer,,Commercial Lines,,10,Promoter,Strongly Agree,Integrity has been with our agency from the start. It's easy to get a hold of our underwriters and they are helpful and Knowledgeable.,
2242,Customer Service Representative (CSR),,Commercial Lines,,5,Neutral,Neither Agree nor Disagree,I have not had a lot of experience with using Grange.,
4959,Customer Service Representative (CSR),Personal Lines,Commercial Lines,,8,Promoter,Agree,easy to quote,Positive
4038,Principal,Personal Lines,Commercial Lines,Life,9,Promoter,Strongly Agree,,
3401641,Producer,Personal Lines,,,6,Neutral,Somewhat Agree,The website is not user friendly.,
1601271,Principal,Personal Lines,Commercial Lines,Life,9,Promoter,Strongly Agree,Website and Technology is extremely user friendly and easy to use and navigate,
48,Principal,Personal Lines,,,9,Detractor,Neither Agree nor Disagree,Havent been one of our more competitive companies,
4483,Principal,Personal Lines,,Life,10,Neutral,Agree,"competitive rates, continually upgrade technology, keep up with new sales trends",Positive
