agency,role,PL,CL,Life,score,NPS,is_easy,comments,category
4080,Producer,Personal Lines,Commercial Lines,Life,10,Neutral,Strongly Disagree,"Easy to do business with because of underwriters.   Why a 7 on recommend -- very tight underwriting regarding type of claims and how many, effect of a claim on the rate, and claim service which now does not provide for an appraiser in the field.",
3401201,Principal,Personal Lines,,,10,Detractor,Somewhat Agree,Ohio rates are too high.  Passport product has been ignored for the last 2 years.,
2292,Producer,,Commercial Lines,,7,Neutral,Somewhat Agree,grange is a great company. The biggest draw back is the website. It isn't the most user friendly and makes you take unnecessary step to do what you want to do,
48029,Principal,Personal Lines,,,8,Neutral,Agree,"My Underwriter Carol Zimmerman and Jodi Raasch,and their excellent service.",Positive
3401216,Producer,Personal Lines,Commercial Lines,,10,Promoter,Strongly Agree,"Helpful people, easy to use website, and rates are pretty competitive.",
3402018,Principal,Personal Lines,,,9,Promoter,Agree,Generally easy system to navigate. Rates and product are very competitive.,Positive
22019,Producer,Personal Lines,,,7,Neutral,Somewhat Agree,Appetite could be a little better on personal lines.  Less stricter guidelines for new business.,
48787,Producer,Personal Lines,Commercial Lines,,4,Detractor,Neither Agree nor Disagree,It has become harder to place business with your appetite shrinking and commission declining.,
4063,Customer Service Representative (CSR),Personal Lines,,,10,Promoter,Strongly Agree,Grange is an easy company to work with and our underwriter Travis Frye is amazing. He is so helpful and fun to talk to.,
145,Producer,,Commercial Lines,,6,Detractor,Somewhat Disagree,we would like to see a Grange representative from time to time,
1001030,Principal,Personal Lines,Commercial Lines,Life,9,Neutral,Agree,,
39124,Principal,Personal Lines,,Life,9,Promoter,Strongly Agree,"I appreciate being able to talk to an underwrite without talking to a robot for 5 min prior to talking to a person.  I also appreciate the stability of the company, ease of doing business, and the great customer service.",
1001016,Customer Service Representative (CSR),Personal Lines,,,8,Neutral,Agree,rates not as competitive as our other carriers.  Service is good,Positive
3401145,Customer Service Representative (CSR),Personal Lines,,,8,Neutral,Agree,Clients are looking for low premiums and Grange does not always have the best rates.  Grange is usually easy to quote,Positive
3401878,Producer,Personal Lines,,,10,Neutral,Strongly Agree,Home Insurance rates could be better compared to other companies.  System is very user friendly,
4538,Customer Service Representative (CSR),Personal Lines,,,6,Detractor,Somewhat Agree,The new products are more difficult to quote and the premiums are not competitive in most cases,
1889,Principal,,Commercial Lines,,5,Detractor,Neither Agree nor Disagree,,
3701585,Customer Service Representative (CSR),Personal Lines,,,3,Detractor,Somewhat Disagree,"I use Grange if they have a significant price advantage. Otherwise, I do not typically recommend them as they aren't that competitive when it comes to rates. As for doing business with Grange, the split system makes things confusing and it is impossible to get ahold of our underwriter. Not only that, but I have noticed inconsistencies when it comes to answers from underwriters.",
3701308,Customer Service Representative (CSR),Personal Lines,,,9,Promoter,Agree,I placed my own insurance with Grange so I have no problem recommending you.  I am still learning your online system so it may be a bit more difficult for me than for other agents but one phone call usually gets me over the hump of any problem I'm having.,Positive
4565,Principal,Personal Lines,Commercial Lines,Life,8,Neutral,Agree,"5 years ago, the answer would be strongly agree.  Over the past few years Grange continuous and more frequent changes to programs and agent compensation has made Grange more difficult to work with.",Service
4741,Principal,,Commercial Lines,,8,Promoter,Agree,Our local rep is great!  Quick decisions and quick turnarounds - Leslie Rocks!,Positive
48240,Producer,Personal Lines,,,10,Promoter,Agree,Satisfied with most of the services with the company.,Positive
2101361,Customer Service Representative (CSR),,Commercial Lines,,7,Neutral,Agree,Our underwriters and marketing rep always make us feel like we can place business with Grange.,Positive
4745,Customer Service Representative (CSR),Personal Lines,,,10,Promoter,Agree,Grange has a very easy to use quoting system.,Positive
1201164,Other,,Commercial Lines,,5,Detractor,Somewhat Disagree,Decline to quote submissions. sdfsdfsadfsadfsdafsadfsd,
1061,Principal,Personal Lines,Commercial Lines,,8,Detractor,Somewhat Disagree,As a P\C agent we have lost over a half a million dolles in business with Grange. Homeowners rates have made Grange go from our go to carrier to our third carrier. Very sad !!!,
3115,Producer,Personal Lines,Commercial Lines,Life,7,Neutral,Somewhat Agree,"Grange auto insurance rating system, new credit scoring model, and the pinpoint rating system has made it difficult to place business with Grange. Hoping they make more changes to be again the carrier they used to be for us.",
3901214,Principal,Personal Lines,,Life,10,Promoter,Strongly Agree,Grange is very is to do business with.,
3701533,Principal,Personal Lines,Commercial Lines,Life,10,Promoter,Strongly Agree,"Because its true, A lot of companies talk abut how easy they are to deal with, Grange actually delivers!",
4803,Customer Service Representative (CSR),Personal Lines,,,10,Promoter,Strongly Agree,Ease of website. Even before changes. Though..hard to get hold of an underwriter,
3701001,Producer,Personal Lines,,,8,Promoter,Agree,"Grange is an excellent company with good claim handling by & large. When there is a problem, it isn't hard to find the right person to correct it. EODB is very responsive to suggestions.",Positive
4887,Customer Service Representative (CSR),Personal Lines,,,8,Promoter,Somewhat Agree,"constant change in programs is confusion between determining if a policy is written in mutual , pin point or the new system and what's covered",
423,Other,Personal Lines,,,10,Promoter,Strongly Agree,"I personally have a policy with you and paying my bills, getting changes done, etc are very easy.",
3701490,Producer,Personal Lines,,,8,Neutral,Somewhat Agree,The claims service some of my clients have received has been very slow and they have not been very happy.,
1301822,Producer,Personal Lines,,,8,Promoter,Agree,I have several options.  Grange system is very simple to navigate through.,Positive
4360,Producer,Personal Lines,,,10,Promoter,Strongly Agree,GRANGE IS A GOOD COMPANY AND HAVE EXCELLENT SERVICE,
3701032,Customer Service Representative (CSR),Personal Lines,,,6,Neutral,Somewhat Agree,website isn't always the easiest to use,
22772,Producer,Personal Lines,Commercial Lines,,0,Detractor,Somewhat Disagree,Most of what I have placed with Integrity has stuck once we find something that is competitive,
3701241,Producer,,Commercial Lines,,7,Promoter,Disagree,We are constantly getting new Underwriters which make it very difficult to build a relationship with the company and what they are looking for to insure.,
3401045,Principal,Personal Lines,,,7,Promoter,Strongly Agree,,
3701552,Other,,Commercial Lines,,8,Neutral,Somewhat Agree,I think some items have to be rated online to get quotes but I could be wrong.   auto seems high,
3135,Producer,Personal Lines,,,10,Promoter,Strongly Agree,"Hi quality company.  But I also must compare requirements of prospects and my current prospect is considering not choosing GRI because their current company and another company doesn't require fencing around pools 4' and higher, although they recommend it.",
2101169,Producer,Personal Lines,,,5,Neutral,Neither Agree nor Disagree,"Not a ton of experience writing with Grange. When applicable, Grange offers competitive rates.",
3683,Customer Service Representative (CSR),Personal Lines,,,9,Promoter,Agree,Have never had any issue dealing with grange. Have my personal insurance with them as well.,Positive
2155,Producer,,,Life,7,Neutral,Somewhat Agree,Personal Lines has not been much of a factor in Illinois for the last 8 years.  Good company that usually does well with claims.,
3701145,Producer,,Commercial Lines,,10,Promoter,Agree,Grange has always maintained a user friendly quoting platform with real time rating capability and I appreciate that.,Positive
1601478,Principal,Personal Lines,Commercial Lines,,9,Promoter,Agree,EASE OF DOING BUSINESS,Positive
39046,Producer,Personal Lines,,,4,Neutral,Somewhat Agree,Underwriting is not always easy to get in touch with.  SCRs don't like website for checking quotes and 'hangover' from how tough it use to be to take a payment and upload,
48798,Principal,Personal Lines,Commercial Lines,,9,Promoter,Strongly Agree,"Terrific coverage, ease of system use, Carol Zimmerman is always quick in her response time and thorough leaving nothing to chance.",
1301784,Producer,Personal Lines,,,9,Promoter,Agree,"We've been working with Grange for over a year.  Mostly all positive feedback so far.  Still having some issues with Coverage A being changed after issue and the cost estimator on homes not matching.  Otherwise, no issues!",Positive
4803,Customer Service Representative (CSR),Personal Lines,,,10,Promoter,Strongly Agree,"Grange has several Programs, easy to work with, good claim service.",
4799,Principal,Personal Lines,Commercial Lines,Life,7,Promoter,Somewhat Agree,rates on the home aren't that competitive,
455,Producer,Personal Lines,,,9,Neutral,Strongly Agree,Grange is very easy  to do business with  but the premiums are high preventing us from placing as much business as we would like to with Grange.,
48665,Producer,,Commercial Lines,,5,Neutral,Somewhat Agree,Integrity is not as easy to write business with as other carriers.,
22188,Principal,,Commercial Lines,,8,Promoter,Strongly Agree,"Easy to work with, like my underwriters.",
1301677,Customer Service Representative (CSR),Personal Lines,,,8,Neutral,Agree,"Website is easy to navigate, Underwriting is always available for questions or concerns.",Positive
1201001,Producer,,,Life,10,Promoter,Strongly Agree,,
22413,Producer,Personal Lines,Commercial Lines,Life,3,Promoter,Somewhat Agree,I wish the on-line software was easier to use.,
21087,Customer Service Representative (CSR),Personal Lines,,,9,Promoter,Agree,"Good policies, everyone is always helpful when calling in.",Positive
3401184,Principal,Personal Lines,,,10,Promoter,Strongly Agree,Grange goes above and beyond the call of duty. Very friendly and professional people,
1001021,Principal,Personal Lines,,Life,6,Promoter,Agree,We love the products and service offered by grange and the people are terrific to work with!,Positive
4910,Customer Service Representative (CSR),Personal Lines,,,10,Promoter,Strongly Agree,Rating website is extremely easy and underwriting is always very helpful if one has a question.,
3402086,Customer Service Representative (CSR),Personal Lines,,,8,Detractor,Somewhat Disagree,antiquated billing system- cannot make changes quickly- have to wait days to see it on our end; EFT info cannot be changed without calling service center; EFT date cannot be changed mid term while other carriers allow change anytime; one of only carriers I have ever seen that requires UMPD in addition to collision;  system is user friendly from sales perspective but not for service,
1040,Customer Service Representative (CSR),,Commercial Lines,,8,Neutral,Strongly Disagree,It is too complicated to explain to customers why their auto policy premium goes up when they delete a vehicle (Ratio) and why the premium increases if they change the mailing address.  We have seen some auto premiums increase $400.00 because they went from a PO Box to a street address.,
1040,Customer Service Representative (CSR),Personal Lines,,,5,Promoter,Strongly Disagree,"Because it is very hard to do business with a company that increases a premium because, for example, you change a mailing address on an auto policy.",
3401582,Principal,Personal Lines,,Life,8,Neutral,Agree,,
48168,Principal,,Commercial Lines,,9,Promoter,Strongly Agree,,
165,Customer Service Representative (CSR),Personal Lines,Commercial Lines,,9,Promoter,Agree,"Your rates are very competitive.  I do find your website a bit hard to navigate.  It is sometimes hard to find the correct area I am looking for and I have had to call your IT department for assistance with this several times.  It would help if you could make your links a bit more ""obvious"" or intuitive/user-friendly.",User Design
4876,Customer Service Representative (CSR),Personal Lines,,,9,Promoter,Agree,,
3402091,Principal,Personal Lines,,,10,Promoter,Agree,Rates are competitive in our area and system is easy to quote,Positive
3979,Producer,Personal Lines,Commercial Lines,,10,Promoter,Agree,,
39011,Producer,Personal Lines,,,7,Neutral,Agree,There are very little companies that are standard markets that are written auto coverage,Positive
22703,Principal,Personal Lines,,,9,Neutral,Somewhat Agree,There seems to be more billing problems than other carriers.  Not much stability with rates.,
4372,Customer Service Representative (CSR),Personal Lines,,,5,Detractor,Somewhat Agree,"Grange is always making to many changes to their policies.  We offer other companies and not a single one of them seem to be having problems with ratings. Each company has 1 auto for mutual and 1 for non standard and they don't have to keep coming up with fa,pa, pa3, pkg. It is crazy",
21076,Producer,Personal Lines,Commercial Lines,Life,9,Detractor,Somewhat Disagree,"You changed our underwriter to Angie Levinson,  we wrote a home policy in Plymouth for a couple of attorneys, very updated home granite countertops throughout wood floors, she insisted we use economy for the quality of construction which produced a dwelling limit way below what the clients wanted and she wouldn't budge, we spent hours trying to convince her with photos etc and eventually lost a good client.  Recently 2 of our clints had claims, the adjustors went out entered the cost of their damages in their computer and sent a check, the estimates were considerably less than the actual cost of repairs, and the adjustors would never call them back.  By the time the insured's contacted me, they were very upset, Andy Connell the claims supervisor stepped in and really took care of things, but insured's should not have to battle tohave their homes repaired.  These were legitimate uncontrollable claims.  I tried to email the different adjustors, and they didn't e mail me back.  I tried calling them and they did not answer and their mailboxes were full.  So you need to fix our underwriter and you need to fix your claims adjustors.",
45019,Producer,Personal Lines,,,10,Promoter,Strongly Agree,"I personally, as a Grange producer, have my auto insurance with Grange and I enjoy dealing with Grange in the office.",
3701403,Customer Service Representative (CSR),Personal Lines,,,10,Promoter,Strongly Agree,great customer service,Positive
4571,Customer Service Representative (CSR),Personal Lines,,Life,7,Neutral,Agree,Like the ability to view status online and get updates,Positive
6361,Principal,Personal Lines,,,9,Promoter,Agree,,
4471,Producer,Personal Lines,Commercial Lines,Life,9,Promoter,Agree,"ADVANCED TECHNOLOGY COMPARED TO SOME OF OUR OTHER CARRIERS, GOOD RATES.",Positive
1201605,Customer Service Representative (CSR),Personal Lines,,Life,10,Promoter,Agree,The website is user friendly as well as the staff is extremely helpful when questions and issues do arise,Positive
21037,Other,,Commercial Lines,,5,Detractor,Neither Agree nor Disagree,,
48602,Producer,Personal Lines,,,9,Promoter,Strongly Agree,My underwriters usually try to find ways to write a risk rather than find ways to decline (unless there is something very wrong with it).,
1067,Producer,Personal Lines,Commercial Lines,Life,10,Promoter,Agree,Quoting system is easy to use. Chat feature is very helpful if main underwriter is unavailable.,Positive
3401608,Customer Service Representative (CSR),Personal Lines,,,7,Neutral,Strongly Agree,,
4592,Producer,Personal Lines,,,7,Detractor,Somewhat Agree,I fell like most of the complaints I receive on how claims were handled come from Grange customers,
557,Producer,Personal Lines,,,9,Promoter,Strongly Agree,New Pin Point is easy to rate fro auto and home plenty of options,
2217,Other,,Commercial Lines,,9,Promoter,Agree,"Easy to use rating system, pricing and coverage terms",Positive
3701259,Customer Service Representative (CSR),Personal Lines,,,9,Promoter,Strongly Agree,"Quoting is fast and easy.  Anytime I've needed to contact Grange, I've had excellent customer service.",
48003,Producer,Personal Lines,,,9,Promoter,Agree,Very easy company to work with in all from quotes to questions,Positive
1301168,Customer Service Representative (CSR),Personal Lines,,,8,Neutral,Agree,Great company - best employees!,Positive
3701194,Customer Service Representative (CSR),,Commercial Lines,,7,Neutral,Agree,grange has a liberal appetite and their system is fairly user friendly - and has quick responses to inquiries while quoting,Positive
3401214,Producer,Personal Lines,,,6,Neutral,Neither Agree nor Disagree,The Ease of doing business is very important. I would rate Grange as very average on this front.,
3401060,Customer Service Representative (CSR),Personal Lines,Commercial Lines,,1,Detractor,Agree,"I would recommend other companies over Grange.  There isn't anything particularly bad about Grange, I just prefer other companies.  Competition is stiff.",Positive
4308,Principal,Personal Lines,,,5,Promoter,Neither Agree nor Disagree,,
21074,Producer,Personal Lines,,,10,Detractor,Somewhat Agree,Rates are not very competitive.,
1301188,Producer,Personal Lines,,,2,Detractor,Disagree,the application process is very cumbersome compared to other carriers when dealing with half the world who live together and  are not married. you require social security numbers and this is the first time in 16 years I had to ask for them.,
4106,Customer Service Representative (CSR),Personal Lines,Commercial Lines,Life,10,Promoter,Strongly Agree,I have had the best & timely responses from our Personal Line Underwriter as well as billing should I have any issues,
4409,Principal,Personal Lines,,,9,Promoter,Agree,You have continually improved your technology but with the recent product changes things have gotten confusing.,Positive
1601428,Customer Service Representative (CSR),Personal Lines,,Life,9,Promoter,Somewhat Agree,The software is easy to use but the rates have not been competitive.,
48600,Customer Service Representative (CSR),Personal Lines,,,10,Promoter,Strongly Agree,The rates are great the ease of quoting home and auto keeps me quoting new clients and existing,
48455,Producer,Personal Lines,,,9,Promoter,Agree,"Good company, competitive rates, user friendly.",Positive
22306,Producer,Personal Lines,,,8,Neutral,Somewhat Agree,Rates compared to the rest of the PL market are just OK,
28,Other,,Commercial Lines,,5,Neutral,Agree,I like working with Grange.  My only feedback is the time it takes to get a quote back after submission; sometimes takes awhile.,Positive
4243,Customer Service Representative (CSR),Personal Lines,,,8,Detractor,Neither Agree nor Disagree,Grange is a good company but price points are not as competitive,
4652,Customer Service Representative (CSR),Personal Lines,,,9,Promoter,Strongly Agree,good rating tools - Outstanding service from our underwriter!,
3401975,Customer Service Representative (CSR),,Commercial Lines,,10,Promoter,Strongly Agree,All I have dealt with are very helpful and knowledgeable.,
14061,Producer,Personal Lines,,,8,Neutral,Agree,User friendly website and quote system.  Rates are competitive.,Positive
3401484,Principal,Personal Lines,,,7,Promoter,Somewhat Agree,We'd like to have more payment options available especially on new business.,
1201164,Principal,Personal Lines,Commercial Lines,Life,5,Detractor,Somewhat Disagree,We keep getting cancelled agent codes.,
3401707,Principal,Personal Lines,Commercial Lines,Life,10,Promoter,Strongly Agree,Grange has the systems that make it easy to quote.,
4013,Producer,Personal Lines,,,9,Promoter,Strongly Agree,,
1396,Principal,Personal Lines,Commercial Lines,Life,9,Neutral,Somewhat Agree,Grange has large appetite but has made the products (personal lines) more complicated than they need to be,
4938,Principal,Personal Lines,Commercial Lines,Life,8,Promoter,Agree,Available,Positive
21337,Customer Service Representative (CSR),Personal Lines,,,7,Neutral,Somewhat Agree,"Your premium in our area is not very competitive.  I have a hard time with Grange premiums coming in where it would be reasonable to offer the coverage.  However, Grange has always been a good company to work with.  If the rates were competitive then I would be placing business with Grange because their claims service and underwriting have always been good to work with.",
6470,Principal,,Commercial Lines,,10,Neutral,Agree,"We appreciate the technology Grange provides for quoting, uploading and servicing our insureds.",Positive
3401958,Customer Service Representative (CSR),,Commercial Lines,,5,Neutral,Neither Agree nor Disagree,Our agency only does commercial lines business with Grange.,
48187,Other,Personal Lines,,,8,Promoter,Agree,Insureds seem to be very happy with the coverage available with Integrity and the rates in our area are also currently very competitive.,Positive
2265,Customer Service Representative (CSR),,Commercial Lines,,6,Promoter,Somewhat Disagree,"The underwriting team is helpful. However, process for renewals, receiving dec pages all to agency, and not separating policies, is not ease of business. Our staff cannot recognize the policy language as not all of them are licensed commercial lines reps.",
3401115,Producer,,,Life,9,Neutral,Agree,web  access,Positive
1001222,Principal,Personal Lines,,,10,Promoter,Strongly Agree,I have partnered with Grange since 2010 and they are easy to work with and all the underwriters/billing personal are a pleasure to do business with.,
6013,Principal,Personal Lines,,,7,Detractor,Neither Agree nor Disagree,Products constantly changing.  Large rate swings.,
21046,Producer,,Commercial Lines,,6,Neutral,Neither Agree nor Disagree,I have yet to quote with Grange,
4860,Principal,Personal Lines,,,7,Promoter,Somewhat Agree,Some cases it is easy and some cases things do not run smoothly.,
22760,Principal,Personal Lines,,,4,Neutral,Somewhat Agree,The rate tends to change once the policy is issued.  Adding drivers without notice.,
3701018,Customer Service Representative (CSR),,Commercial Lines,,9,Neutral,Agree,I haven't done a lot of business with Grange but have quoted some and my agency quotes and has some business with Grange. In minimal experience they are helpful and available and online quoting is fairly simple.,Positive
48468,Principal,Personal Lines,Commercial Lines,,9,Neutral,Agree,Rating is easy,Positive
4371,Customer Service Representative (CSR),Personal Lines,,,8,Detractor,Somewhat Disagree,Our agency has no relationship with Grange by field rep or marketing manager.  Changes made by Grange just seem to make agency use Grange less and less.  Unfamiliarity makes Grange not a go to company.,
4501492,Producer,Personal Lines,,,8,Promoter,Strongly Agree,The online rater is very simple and agent friendly,
4101460,Principal,Personal Lines,Commercial Lines,Life,9,Neutral,Somewhat Agree,"Consistency has been lacking for years.  Grange use to be the go to company.  It seems they come out with a ""new Product"" every 3 years then close and start another",
1301170,Principal,Personal Lines,,,9,Promoter,Strongly Agree,Easy way to quote and write new business,
2070,Customer Service Representative (CSR),Personal Lines,,,8,Neutral,Agree,underwriter great computer program easy to use,Positive
4501094,Producer,Personal Lines,,,4,Promoter,Somewhat Agree,,
22361,Customer Service Representative (CSR),,Commercial Lines,,9,Promoter,Somewhat Agree,Underwriters are usually very responsive. I'm not looking forward to having to submit apps for auto accel.,
3426,Producer,Personal Lines,Commercial Lines,,7,Neutral,Agree,Like doing business with Grange,Positive
1601245,Producer,,Commercial Lines,,8,Promoter,Agree,Easy to deal with so far. UW's are responsive also.,Positive
22188,Principal,,Commercial Lines,,7,Detractor,Agree,"I have yet to quote with Integrity, but to this point I like what I have heard.",Positive
48224,Producer,,Commercial Lines,,10,Promoter,Strongly Agree,Cole is very helpful and explains things needed.,
48102,Producer,Personal Lines,,,7,Detractor,Neither Agree nor Disagree,"I have had some issues with the homeowners inspection process. Many times the Dwelling coverage comes back with a very low number, much lower than any other carrier or RCE.",
4079,Producer,,,Life,10,Promoter,Strongly Agree,excellent service and prices etc.,
4702,Customer Service Representative (CSR),Personal Lines,,,9,Promoter,Strongly Agree,policies are easy to quote good tenant rates,
48790,Principal,Personal Lines,Commercial Lines,,9,Promoter,Agree,We have had a huge improvement in underwrinting of the past year.,Positive
1492,Producer,Personal Lines,,,7,Promoter,Somewhat Agree,System does not flow well.,
3701072,Principal,Personal Lines,,,10,Promoter,Strongly Agree,,
1201001,Producer,Personal Lines,,Life,7,Promoter,Agree,Pricing is always a factor in Chicago.,Positive
3438,Other,Personal Lines,,,9,Neutral,Agree,Grange meets the technological needs of my agency and our customers,Positive
